SMAP:  Trial 3 finished with values: [0.9189139405275458, -375555.0] and parameters: {'lr': 1.4109443283462657e-05, 'dropout_rate': 0.1755720259905254, 'dim_feedforward': 95, 'batch': 16, 'encoder_layers': 2, 'decoder_layers': 3, 'activation_function': 'sigmoid', 'time_warping': True, 'time_masking': False, 'gaussian_noise': 0.0004472580884683208, 'use_linear_embedding': False, 'phase_type': '2phase', 'self_conditioning': True, 'layer_norm': False, 'positional_encoding_type': 'fourier', 'num_ffn_layers': 3}. 
Trial Number: 7 (Trial 7 finished with values: [0.9326633402421077, 78306.0] and parameters: {'lr': 0.003151456826123189, 'dropout_rate': 0.4305067365468159, 'dim_feedforward': 77, 'batch': 64, 'encoder_layers': 1, 'decoder_layers': 2, 'activation_function': 'leaky_relu', 'time_warping': True, 'time_masking': False, 'gaussian_noise': 0.0025879066400618603, 'use_linear_embedding': True, 'phase_type': 'iterative', 'self_conditioning': False, 'layer_norm': False, 'positional_encoding_type': 'fourier', 'num_ffn_layers': 1}. 

)

{'FN': 0,
 'FP': 108,
 'Hit@100%': 1.0,
 'Hit@150%': 1.0,
 'NDCG@100%': 1.0,
 'NDCG@150%': 1.0,
 'ROC/AUC': 0.9930385458295733,
 'TN': 7649,
 'TP': 748,
 'f1': 0.9326633402421077,
 'precision': 0.8738317654926195,
 'recall': 0.9999999866310163,
 'threshold': 0.040767982262028525}

  Value for F1: 0.9326633402421077
  Number of Parameters: -78306.0
  Params: 
    lr: 0.003151456826123189
    dropout_rate: 0.4305067365468159
    dim_feedforward: 77
    batch: 64
    encoder_layers: 1
    decoder_layers: 2
    activation_function: leaky_relu
    time_warping: True
    time_masking: False
    gaussian_noise: 0.0025879066400618603
    use_linear_embedding: True
    phase_type: iterative
    self_conditioning: False
    layer_norm: False
    positional_encoding_type: fourier
    num_ffn_layers: 1

Trial Number: 10 ( Trial 10 finished with values: [0.9462315616484884, 103479.0] and parameters: {'lr': 0.00021281700905323122, 'dropout_rate': 0.2353371090727513, 'dim_feedforward': 101, 'batch': 32, 'encoder_layers': 2, 'decoder_layers': 1, 'activation_function': 'sigmoid', 'time_warping': False, 'time_masking': True, 'gaussian_noise': 0.0001510559032731608, 'use_linear_embedding': False, 'phase_type': '2phase', 'self_conditioning': False, 'layer_norm': False, 'positional_encoding_type': 'sinusoidal', 'num_ffn_layers': 1}. 
)

{'FN': 0,
 'FP': 85,
 'Hit@100%': 1.0,
 'Hit@150%': 1.0,
 'NDCG@100%': 1.0,
 'NDCG@150%': 1.0,
 'ROC/AUC': 0.9945210777362382,
 'TN': 7672,
 'TP': 748,
 'f1': 0.9462315616484884,
 'precision': 0.8979591728936475,
 'recall': 0.9999999866310163,
 'threshold': 0.11468736947157701}

  Value for F1: 0.9462315616484884
  Number of Parameters: -103479.0
  Params: 
    lr: 0.00021281700905323122
    dropout_rate: 0.2353371090727513
    dim_feedforward: 101
    batch: 32
    encoder_layers: 2
    decoder_layers: 1
    activation_function: sigmoid
    time_warping: False
    time_masking: True
    gaussian_noise: 0.0001510559032731608
    use_linear_embedding: False
    phase_type: 2phase
    self_conditioning: False
    layer_norm: False
    positional_encoding_type: sinusoidal
    num_ffn_layers: 1

Trial Number: 14 (Trial 14 finished with values: [0.9510439509639704, 106029.0] and parameters: {'lr': 0.00046804379049615705, 'dropout_rate': 0.12297660123174858, 'dim_feedforward': 126, 'batch': 128, 'encoder_layers': 3, 'decoder_layers': 1, 'activation_function': 'tanh', 'time_warping': True, 'time_masking': False, 'gaussian_noise': 0.001415549158217021, 'use_linear_embedding': True, 'phase_type': 'iterative', 'self_conditioning': False, 'layer_norm': True, 'positional_encoding_type': 'fourier', 'num_ffn_layers': 1}. 
)

{'FN': 0,
 'FP': 77,
 'Hit@100%': 1.0,
 'Hit@150%': 1.0,
 'NDCG@100%': 1.0,
 'NDCG@150%': 1.0,
 'ROC/AUC': 0.9950367410081217,
 'TN': 7680,
 'TP': 748,
 'f1': 0.9510439509639704,
 'precision': 0.9066666556767679,
 'recall': 0.9999999866310163,
 'threshold': 0.08382507249156276}

  Value for F1: 0.9510439509639704
  Number of Parameters: -106029.0
  Params: 
    lr: 0.00046804379049615705
    dropout_rate: 0.12297660123174858
    dim_feedforward: 126
    batch: 128
    encoder_layers: 3
    decoder_layers: 1
    activation_function: tanh
    time_warping: True
    time_masking: False
    gaussian_noise: 0.001415549158217021
    use_linear_embedding: True
    phase_type: iterative
    self_conditioning: False
    layer_norm: True
    positional_encoding_type: fourier
    num_ffn_layers: 1

Trial Number: 20 (Trial 20 finished with values: [0.9274593669727764, 37857.0] and parameters: {'lr': 0.007404340064880197, 'dropout_rate': 0.3865604406011236, 'dim_feedforward': 8, 'batch': 96, 'encoder_layers': 1, 'decoder_layers': 1, 'activation_function': 'leaky_relu', 'time_warping': True, 'time_masking': False, 'gaussian_noise': 0.015618116987090182, 'use_linear_embedding': True, 'phase_type': 'iterative', 'self_conditioning': True, 'layer_norm': False, 'positional_encoding_type': 'sinusoidal', 'num_ffn_layers': 2}. 
)

{'FN': 0,
 'FP': 117,
 'Hit@100%': 1.0,
 'Hit@150%': 1.0,
 'NDCG@100%': 1.0,
 'NDCG@150%': 1.0,
 'ROC/AUC': 0.9924584246487044,
 'TN': 7640,
 'TP': 748,
 'f1': 0.9274593669727764,
 'precision': 0.8647398743960708,
 'recall': 0.9999999866310163,
 'threshold': 0.012574981901025196}
25

  Value for F1: 0.9274593669727764
  Number of Parameters: -37857.0
  Params: 
    lr: 0.007404340064880197
    dropout_rate: 0.3865604406011236
    dim_feedforward: 8
    batch: 96
    encoder_layers: 1
    decoder_layers: 1
    activation_function: leaky_relu
    time_warping: True
    time_masking: False
    gaussian_noise: 0.015618116987090182
    use_linear_embedding: True
    phase_type: iterative
    self_conditioning: True
    layer_norm: False
    positional_encoding_type: sinusoidal
    num_ffn_layers: 2

Trial Number: 58 (Trial 58 finished with values: [0.940284132368876, 79897.0] and parameters: {'lr': 0.008148167206082933, 'dropout_rate': 0.4826624194041188, 'dim_feedforward': 124, 'batch': 128, 'encoder_layers': 2, 'decoder_layers': 1, 'activation_function': 'tanh', 'time_warping': True, 'time_masking': False, 'gaussian_noise': 0.053328487429632254, 'use_linear_embedding': False, 'phase_type': 'iterative', 'self_conditioning': True, 'layer_norm': True, 'positional_encoding_type': 'fourier', 'num_ffn_layers': 1}. 
)

{'FN': 0,
 'FP': 95,
 'Hit@100%': 1.0,
 'Hit@150%': 1.0,
 'NDCG@100%': 1.0,
 'NDCG@150%': 1.0,
 'ROC/AUC': 0.9938764986463838,
 'TN': 7662,
 'TP': 748,
 'f1': 0.940284132368876,
 'precision': 0.8873072255360946,
 'recall': 0.9999999866310163,
 'threshold': 0.0398425684404271}
25

  Value for F1: 0.940284132368876
  Number of Parameters: -79897.0
  Params: 
    lr: 0.008148167206082933
    dropout_rate: 0.4826624194041188
    dim_feedforward: 124
    batch: 128
    encoder_layers: 2
    decoder_layers: 1
    activation_function: tanh
    time_warping: True
    time_masking: False
    gaussian_noise: 0.053328487429632254
    use_linear_embedding: False
    phase_type: iterative
    self_conditioning: True
    layer_norm: True
    positional_encoding_type: fourier
    num_ffn_layers: 1

Trial Number: 74 (Trial 74 finished with values: [0.9426541098164691, 90700.0] and parameters: {'lr': 0.0026640310823343185, 'dropout_rate': 0.27293206661641484, 'dim_feedforward': 35, 'batch': 32, 'encoder_layers': 3, 'decoder_layers': 2, 'activation_function': 'tanh', 'time_warping': True, 'time_masking': True, 'gaussian_noise': 0.02035433512458904, 'use_linear_embedding': False, 'phase_type': 'iterative', 'self_conditioning': False, 'layer_norm': True, 'positional_encoding_type': 'fourier', 'num_ffn_layers': 1}. 
{'FN': 0,
 'FP': 91,
 'Hit@100%': 1.0,
 'Hit@150%': 1.0,
 'NDCG@100%': 1.0,
 'NDCG@150%': 1.0,
 'ROC/AUC': 0.9941343302823256,
 'TN': 7666,
 'TP': 748,
 'f1': 0.9426541098164691,
 'precision': 0.8915375340698745,
 'recall': 0.9999999866310163,
 'threshold': 0.05315953338047712}

  Value for F1: 0.9426541098164691
  Number of Parameters: -90700.0
  Params: 
    lr: 0.0026640310823343185
    dropout_rate: 0.27293206661641484
    dim_feedforward: 35
    batch: 32
    encoder_layers: 3
    decoder_layers: 2
    activation_function: tanh
    time_warping: True
    time_masking: True
    gaussian_noise: 0.02035433512458904
    use_linear_embedding: False
    phase_type: iterative
    self_conditioning: False
    layer_norm: True
    positional_encoding_type: fourier
    num_ffn_layers: 1
.................................................................................
UCR: Params: 
    lr: 0.08042928852931656
    dropout_rate: 0.2625375822546474
    dim_feedforward: 121
    batch: 32
    encoder_layers: 2
    decoder_layers: 3
    activation_function: tanh
    time_warping: False
    time_masking: False
    gaussian_noise: 0.0027309589061422297
    use_linear_embedding: False
    phase_type: 2phase
    self_conditioning: False
    layer_norm: False
    positional_encoding_type: sinusoidal
    num_ffn_layers: 3

Trial 92 finished with values: [0.999994909934918, -1995.0] and parameters: {'lr': 0.001999752227224363, 'dropout_rate': 0.44740636617497487, 'dim_feedforward': 124, 'batch': 48, 'encoder_layers': 1, 'decoder_layers': 2, 'activation_function': 'leaky_relu', 'time_warping': True, 'time_masking': True, 'gaussian_noise': 0.027956473148717333, 'use_linear_embedding': True, 'phase_type': 'iterative', 'self_conditioning': True, 'layer_norm': False, 'positional_encoding_type': 'fourier', 'num_ffn_layers': 1}.
Trial 99 finished with values: [0.9736791286036708, -4574.0] and parameters: {'lr': 0.08042928852931656, 'dropout_rate': 0.2625375822546474, 'dim_feedforward': 121, 'batch': 32, 'encoder_layers': 1, 'decoder_layers': 3, 'activation_function': 'leaky_relu', 'time_warping': False, 'time_masking': False, 'gaussian_noise': 0.0027309589061422297, 'use_linear_embedding': True, 'phase_type': '2phase', 'self_conditioning': False, 'layer_norm': True, 'positional_encoding_type': 'sinusoidal', 'num_ffn_layers': 1}.

         f1  precision  recall     TP      TN   FP   FN   ROC/AUC  threshold
0  0.991066   0.982301     1.0  111.0  5787.0  2.0  0.0  0.999827   0.001571
{'FN': 0,
 'FP': 2,
 'Hit@100%': 1.0,
 'Hit@150%': 1.0,
 'ROC/AUC': 0.9998272585938849,
 'TN': 5787,
 'TP': 111,
 'f1': 0.9910663405067339,
 'precision': 0.9823007980264781,
 'recall': 0.999999909909918,
 'threshold': 0.0015713025737918418}
1

Best trials on the Pareto front:
Trial Number: 0
  Value for F1: 0.9910663405067339
  Number of Parameters: -1690.0
  Params: 
    lr: 0.005942922965420524
    dropout_rate: 0.3187256380469774
    dim_feedforward: 105
    batch: 48
    encoder_layers: 2
    decoder_layers: 1
    activation_function: leaky_relu
    time_warping: True
    time_masking: True
    gaussian_noise: 0.00042317302142263927
    use_linear_embedding: True
    phase_type: iterative
    self_conditioning: False
    layer_norm: True
    positional_encoding_type: sinusoidal
    num_ffn_layers: 1
Trial Number: 27
  Value for F1: 0.9527846289564811
  Number of Parameters: -1293.0
  Params: 
    lr: 0.0034622888061300087
    dropout_rate: 0.11031671485423256
    dim_feedforward: 17
    batch: 64
    encoder_layers: 2
    decoder_layers: 2
    activation_function: leaky_relu
    time_warping: True
    time_masking: False
    gaussian_noise: 0.00032881465329825027
    use_linear_embedding: True
    phase_type: 2phase
    self_conditioning: False
    layer_norm: False
    positional_encoding_type: sinusoidal
    num_ffn_layers: 2
Trial Number: 33
  Value for F1: 0.6851806384611954
  Number of Parameters: -816.0
  Params: 
    lr: 0.00736835276725967
    dropout_rate: 0.16823946694182923
    dim_feedforward: 25
    batch: 112
    encoder_layers: 3
    decoder_layers: 1
    activation_function: tanh
    time_warping: False
    time_masking: True
    gaussian_noise: 0.0010920289224161446
    use_linear_embedding: True
    phase_type: 2phase
    self_conditioning: True
    layer_norm: True
    positional_encoding_type: sinusoidal
    num_ffn_layers: 1
Trial Number: 34
  Value for F1: 0.7844474737144725
  Number of Parameters: -1191.0
  Params: 
    lr: 0.008677559173195747
    dropout_rate: 0.22996013392912396
    dim_feedforward: 40
    batch: 112
    encoder_layers: 3
    decoder_layers: 2
    activation_function: relu
    time_warping: True
    time_masking: False
    gaussian_noise: 0.0006652049949237063
    use_linear_embedding: True
    phase_type: iterative
    self_conditioning: False
    layer_norm: True
    positional_encoding_type: fourier
    num_ffn_layers: 1
Trial Number: 60
  Value for F1: 0.8072678543096793
  Number of Parameters: -1206.0
  Params: 
    lr: 0.005942922965420524
    dropout_rate: 0.3187256380469774
    dim_feedforward: 73
    batch: 48
    encoder_layers: 2
    decoder_layers: 1
    activation_function: relu
    time_warping: True
    time_masking: True
    gaussian_noise: 0.00042317302142263927
    use_linear_embedding: True
    phase_type: iterative
    self_conditioning: False
    layer_norm: False
    positional_encoding_type: sinusoidal
    num_ffn_layers: 1
Trial Number: 72
  Value for F1: 0.0
  Number of Parameters: -641.0
  Params: 
    lr: 0.0028709922142145508
    dropout_rate: 0.2966549450575281
    dim_feedforward: 24
    batch: 128
    encoder_layers: 2
    decoder_layers: 2
    activation_function: tanh
    time_warping: False
    time_masking: False
    gaussian_noise: 0.00014673478561420768
    use_linear_embedding: True
    phase_type: iterative
    self_conditioning: True
    layer_norm: False
    positional_encoding_type: fourier
    num_ffn_layers: 1
Trial Number: 87
  Value for F1: 0.757674422794751
  Number of Parameters: -1011.0
  Params: 
    lr: 0.0028547158114924994
    dropout_rate: 0.4156920457681029
    dim_feedforward: 8
    batch: 96
    encoder_layers: 2
    decoder_layers: 3
    activation_function: relu
    time_warping: False
    time_masking: False
    gaussian_noise: 0.0027935919050456363
    use_linear_embedding: False
    phase_type: 2phase
    self_conditioning: True
    layer_norm: False
    positional_encoding_type: sinusoidal
    num_ffn_layers: 2


MBA:

Best trials on the Pareto front:
Trial Number: 3

[I 2023-11-16 16:29:23,516] Trial 3 finished with values: [0.9910374971253099, 1902.0] and parameters: {'lr': 0.003441494569006896, 'dropout_rate': 0.1795420114126578, 'dim_feedforward': 41, 'batch': 16, 'encoder_layers': 3, 'decoder_layers': 1, 'activation_function': 'tanh', 'time_warping': True, 'time_masking': False, 'gaussian_noise': 0.00792473668989539, 'use_linear_embedding': False, 'phase_type': 'iterative', 'self_conditioning': False, 'layer_norm': False, 'positional_encoding_type': 'fourier', 'num_ffn_layers': 1}. 
        f1  precision  recall      TP      TN    FP   FN   ROC/AUC  threshold
0  0.98559   0.971599     1.0  2600.0  5004.0  76.0  0.0  0.992520   0.001106
1  0.98503   0.970511     1.0  2600.0  5001.0  79.0  0.0  0.992224   0.000475
{'FN': 0,
 'FP': 47,
 'Hit@100%': 1.0,
 'Hit@150%': 1.0,
 'NDCG@100%': 1.0,
 'NDCG@150%': 1.0,
 'ROC/AUC': 0.9953740157480314,
 'TN': 5033,
 'TP': 2600,
 'f1': 0.9910374971253099,
 'precision': 0.9822440461569926,
 'recall': 0.999999996153846,
 'threshold': 0.0007857234812416754}

  Value for F1: 0.9910374971253099
  Number of Parameters: -1902.0
  Params: 
    lr: 0.003441494569006896
    dropout_rate: 0.1795420114126578
    dim_feedforward: 41
    batch: 16
    encoder_layers: 3
    decoder_layers: 1
    activation_function: tanh
    time_warping: True
    time_masking: False
    gaussian_noise: 0.00792473668989539
    use_linear_embedding: False
    phase_type: iterative
    self_conditioning: False
    layer_norm: False
    positional_encoding_type: fourier
    num_ffn_layers: 1
Trial Number: 35

[I 2023-11-16 16:55:52,271] Trial 35 finished with values: [0.9800176142334727, 593.0] and parameters: {'lr': 0.002602768276636336, 'dropout_rate': 0.3438980750226384, 'dim_feedforward': 9, 'batch': 112, 'encoder_layers': 2, 'decoder_layers': 1, 'activation_function': 'relu', 'time_warping': False, 'time_masking': False, 'gaussian_noise': 0.05890926400262058, 'use_linear_embedding': False, 'phase_type': 'iterative', 'self_conditioning': True, 'layer_norm': True, 'positional_encoding_type': 'fourier', 'num_ffn_layers': 1}. 
         f1  precision  recall      TP      TN     FP   FN   ROC/AUC  \
0  0.967797   0.937613     1.0  2600.0  4907.0  173.0  0.0  0.982972   
1  0.967977   0.937951     1.0  2600.0  4908.0  172.0  0.0  0.983071   

   threshold  
0   0.017082  
1   0.009839  
{'FN': 0,
 'FP': 106,
 'Hit@100%': 1.0,
 'Hit@150%': 1.0,
 'NDCG@100%': 1.0,
 'NDCG@150%': 1.0,
 'ROC/AUC': 0.9895669291338582,
 'TN': 4974,
 'TP': 2600,
 'f1': 0.9800176142334727,
 'precision': 0.9608277865453518,
 'recall': 0.999999996153846,
 'threshold': 0.014491113727871006}
2

  Value for F1: 0.9800176142334727
  Number of Parameters: -593.0
  Params: 
    lr: 0.002602768276636336
    dropout_rate: 0.3438980750226384
    dim_feedforward: 9
    batch: 112
    encoder_layers: 2
    decoder_layers: 1
    activation_function: relu
    time_warping: False
    time_masking: False
    gaussian_noise: 0.05890926400262058
    use_linear_embedding: False
    phase_type: iterative
    self_conditioning: True
    layer_norm: True
    positional_encoding_type: fourier
    num_ffn_layers: 1
Trial Number: 87

